{
  "applicability": "ACTIVE",
  "architecture": {
    "expected_source_sha": "934f5e045af473acdb197604c761597ba39b026c",
    "manifest_digest": "d23952ac68148749c6f94ccad47de6bfa1d048a5233359f618c75721d61d64a6",
    "manifest_path": "/Users/oleksii_makieiev/Documents/startups/evofit-wt-a1-architecture/architecture/acceptance/a1/a0_2_public_api_evidence_input.yaml",
    "manifest_state_status": "MATCHED",
    "source_sha_status": "MATCHED",
    "state": "A0_2_PUBLIC_MODULE_APIS",
    "subject_source_dirty": false,
    "target_source_sha": "934f5e045af473acdb197604c761597ba39b026c"
  },
  "coverage_limits": [
    "AST source imports only; runtime import hooks and dynamically constructed imports are not inspected.",
    "Runtime re-export behavior and callable signatures are not validated; the frozen function names and TaskSummary field names are validated statically.",
    "Conditional imports are reported as source dependencies regardless of runtime branch reachability."
  ],
  "diagnostics": {
    "cross_capability_imports": [
      {
        "classification": "declared_public_interface",
        "imported_name": "TaskSummary",
        "line": 8,
        "source_module": "app.modules.reporting.public",
        "source_path": "app/modules/reporting/public.py",
        "target_capability": "tasks",
        "target_module": "app.modules.tasks.public"
      },
      {
        "classification": "legacy_exception",
        "imported_name": "task_summary",
        "line": 5,
        "source_module": "app.modules.reporting.service",
        "source_path": "app/modules/reporting/service.py",
        "target_capability": "tasks",
        "target_module": "app.modules.tasks.service"
      },
      {
        "classification": "declared_public_interface",
        "imported_name": "record_event",
        "line": 9,
        "source_module": "app.modules.tasks.service",
        "source_path": "app/modules/tasks/service.py",
        "target_capability": "audit",
        "target_module": "app.modules.audit.public"
      },
      {
        "classification": "declared_public_interface",
        "imported_name": "create_notification",
        "line": 10,
        "source_module": "app.modules.tasks.service",
        "source_path": "app/modules/tasks/service.py",
        "target_capability": "notifications",
        "target_module": "app.modules.notifications.public"
      },
      {
        "classification": "declared_public_interface",
        "imported_name": "user_exists",
        "line": 18,
        "source_module": "app.modules.tasks.service",
        "source_path": "app/modules/tasks/service.py",
        "target_capability": "users",
        "target_module": "app.modules.users.public"
      },
      {
        "classification": "declared_public_interface",
        "imported_name": "record_event",
        "line": 9,
        "source_module": "app.modules.users.service",
        "source_path": "app/modules/users/service.py",
        "target_capability": "audit",
        "target_module": "app.modules.audit.public"
      }
    ],
    "exports_by_capability": {
      "audit": {
        "record_event": "function"
      },
      "notifications": {
        "create_notification": "function"
      },
      "reporting": {
        "get_task_summary": "function"
      },
      "tasks": {
        "TaskSummary": "type",
        "get_task_summary": "function"
      },
      "users": {
        "user_exists": "function"
      }
    },
    "imports": [
      {
        "binding": "uuid",
        "imported_module": "uuid",
        "imported_name": null,
        "kind": "import",
        "line": 3,
        "source_capability": "audit",
        "source_module": "app.modules.audit.model",
        "source_path": "app/modules/audit/model.py",
        "target_capability": null,
        "target_module": "uuid"
      },
      {
        "binding": "datetime",
        "imported_module": "datetime",
        "imported_name": "datetime",
        "kind": "from",
        "line": 4,
        "source_capability": "audit",
        "source_module": "app.modules.audit.model",
        "source_path": "app/modules/audit/model.py",
        "target_capability": null,
        "target_module": "datetime"
      },
      {
        "binding": "Any",
        "imported_module": "typing",
        "imported_name": "Any",
        "kind": "from",
        "line": 5,
        "source_capability": "audit",
        "source_module": "app.modules.audit.model",
        "source_path": "app/modules/audit/model.py",
        "target_capability": null,
        "target_module": "typing"
      },
      {
        "binding": "DateTime",
        "imported_module": "sqlalchemy",
        "imported_name": "DateTime",
        "kind": "from",
        "line": 7,
        "source_capability": "audit",
        "source_module": "app.modules.audit.model",
        "source_path": "app/modules/audit/model.py",
        "target_capability": null,
        "target_module": "sqlalchemy"
      },
      {
        "binding": "JSON",
        "imported_module": "sqlalchemy",
        "imported_name": "JSON",
        "kind": "from",
        "line": 7,
        "source_capability": "audit",
        "source_module": "app.modules.audit.model",
        "source_path": "app/modules/audit/model.py",
        "target_capability": null,
        "target_module": "sqlalchemy"
      },
      {
        "binding": "String",
        "imported_module": "sqlalchemy",
        "imported_name": "String",
        "kind": "from",
        "line": 7,
        "source_capability": "audit",
        "source_module": "app.modules.audit.model",
        "source_path": "app/modules/audit/model.py",
        "target_capability": null,
        "target_module": "sqlalchemy"
      },
      {
        "binding": "UUID",
        "imported_module": "sqlalchemy.dialects.postgresql",
        "imported_name": "UUID",
        "kind": "from",
        "line": 8,
        "source_capability": "audit",
        "source_module": "app.modules.audit.model",
        "source_path": "app/modules/audit/model.py",
        "target_capability": null,
        "target_module": "sqlalchemy.dialects.postgresql"
      },
      {
        "binding": "Mapped",
        "imported_module": "sqlalchemy.orm",
        "imported_name": "Mapped",
        "kind": "from",
        "line": 9,
        "source_capability": "audit",
        "source_module": "app.modules.audit.model",
        "source_path": "app/modules/audit/model.py",
        "target_capability": null,
        "target_module": "sqlalchemy.orm"
      },
      {
        "binding": "mapped_column",
        "imported_module": "sqlalchemy.orm",
        "imported_name": "mapped_column",
        "kind": "from",
        "line": 9,
        "source_capability": "audit",
        "source_module": "app.modules.audit.model",
        "source_path": "app/modules/audit/model.py",
        "target_capability": null,
        "target_module": "sqlalchemy.orm"
      },
      {
        "binding": "Base",
        "imported_module": "app.models.base",
        "imported_name": "Base",
        "kind": "from",
        "line": 11,
        "source_capability": "audit",
        "source_module": "app.modules.audit.model",
        "source_path": "app/modules/audit/model.py",
        "target_capability": null,
        "target_module": "app.models.base"
      },
      {
        "binding": "utc_now",
        "imported_module": "app.models.base",
        "imported_name": "utc_now",
        "kind": "from",
        "line": 11,
        "source_capability": "audit",
        "source_module": "app.modules.audit.model",
        "source_path": "app/modules/audit/model.py",
        "target_capability": null,
        "target_module": "app.models.base"
      },
      {
        "binding": "uuid",
        "imported_module": "uuid",
        "imported_name": null,
        "kind": "import",
        "line": 3,
        "source_capability": "audit",
        "source_module": "app.modules.audit.public",
        "source_path": "app/modules/audit/public.py",
        "target_capability": null,
        "target_module": "uuid"
      },
      {
        "binding": "Any",
        "imported_module": "typing",
        "imported_name": "Any",
        "kind": "from",
        "line": 4,
        "source_capability": "audit",
        "source_module": "app.modules.audit.public",
        "source_path": "app/modules/audit/public.py",
        "target_capability": null,
        "target_module": "typing"
      },
      {
        "binding": "Session",
        "imported_module": "sqlalchemy.orm",
        "imported_name": "Session",
        "kind": "from",
        "line": 6,
        "source_capability": "audit",
        "source_module": "app.modules.audit.public",
        "source_path": "app/modules/audit/public.py",
        "target_capability": null,
        "target_module": "sqlalchemy.orm"
      },
      {
        "binding": "_record_event",
        "imported_module": "app.modules.audit.service",
        "imported_name": "record_event",
        "kind": "from",
        "line": 8,
        "source_capability": "audit",
        "source_module": "app.modules.audit.public",
        "source_path": "app/modules/audit/public.py",
        "target_capability": "audit",
        "target_module": "app.modules.audit.service"
      },
      {
        "binding": "uuid",
        "imported_module": "uuid",
        "imported_name": null,
        "kind": "import",
        "line": 3,
        "source_capability": "audit",
        "source_module": "app.modules.audit.repository",
        "source_path": "app/modules/audit/repository.py",
        "target_capability": null,
        "target_module": "uuid"
      },
      {
        "binding": "Any",
        "imported_module": "typing",
        "imported_name": "Any",
        "kind": "from",
        "line": 4,
        "source_capability": "audit",
        "source_module": "app.modules.audit.repository",
        "source_path": "app/modules/audit/repository.py",
        "target_capability": null,